id,read,date added,name,author,type,link,rating,notes,checked out,student,export_id
but-what-is-a-neural-network-deep-learning-chapter-1,FALSE,11/7/2024,But what is a neural network? | Deep learning chapter 1,3b1b,video,https://www.youtube.com/watch?v=aircAruvnKk,,,FALSE,,lec-learning
gradient-descent-how-neural-networks-learn-deep-learning-chapter-2,FALSE,11/7/2024,"Gradient descent, how neural networks learn | Deep Learning Chapter 2",3b1b,video,https://www.youtube.com/watch?v=IHZwWFHWa-w,,,FALSE,,lec-learning
backpropagation-intuitively-deep-learning-chapter-3,FALSE,11/7/2024,"Backpropagation, intuitively | Deep Learning Chapter 3",3b1b,video,https://www.youtube.com/watch?v=Ilg3gGewQ5U,,,FALSE,,lec-learning
backpropagation-calculus-deep-learning-chapter-4,FALSE,11/7/2024,Backpropagation calculus | Deep Learning Chapter 4,3b1b,video,https://www.youtube.com/watch?v=tIeHLnjs5U8,,,FALSE,,lec-learning
large-language-models-explained-briefly,FALSE,11/14/2024,Large Language Models explained briefly,3b1b,video,https://www.youtube.com/watch?v=LPZh9BOjkQs&list=PLZHQObOWTQDNU6R1_67000Dx_ZCJB-3pi&index=5,,,FALSE,,lec-learning
transformers-the-tech-behind-llms-deep-learning-chapter-5,FALSE,11/14/2024,"Transformers, the tech behind LLMs | Deep Learning Chapter 5",3b1b,video,https://www.youtube.com/watch?v=wjZofJX0v4M,,,FALSE,,lec-learning
attention-in-transformers-stepbystep-deep-learning-chapter-6,FALSE,11/14/2024,"Attention in transformers, step-by-step | Deep Learning Chapter 6",3b1b,video,https://www.youtube.com/watch?v=eMlx5fFNoYc,,,FALSE,,lec-learning
minecrafts-smartest-system-is-almost-completely-untapped,FALSE,9/14/2025,Minecraft’s Smartest System Is Almost Completely Untapped,,video,https://youtu.be/Zg0Cxn8AVZA?si=kR2Nk9tu2LwJN2zM,,,FALSE,,lec-learning
prompt-engineering-for-generative-ai-futureproof-inputs-for-reliable-ai-outputs,FALSE,10/19/2025,Prompt Engineering for Generative AI: Future-Proof Inputs for Reliable AI Outputs,,book,https://www.amazon.com/Prompt-Engineering-Generative-AI-Future-Proof/dp/109815343X/ref=sr_1_4?crid=23TXWI265RVJN&dib=eyJ2IjoiMSJ9.ZUPfhUjEtlzJTdR_y8EgsLgPlXKmk4UDVS-EMrnzvcAdxozBHzNsGTOzHis3Py5zFo8JMmNg_5iwxGqMPPXjS-PiplaYkwxIsPw7ZhZMIfPLR_6881G4ET_duW5BOa7WdZwOWR_Va098nbeLBAoy7zS3R7XATtX7X1z93pexkM7x-wVXcQurkafSaPw5mTw5ZGhVRBn0Ta3OgzmOcsSaDIIkcnzoJlnME-oolXBCXDEi16KkStpqpEApjgItm8nwvwU70WgZRenMuc6NQ5gxuTnbew2CC3wygyOa66MOcbE.NOk7MQ-RycOifbEuLy_pIWvpcsLOoE_RixKlme54xfo&dib_tag=se&keywords=prompt+engineering&qid=1761058129&s=books&sprefix=Prompt+%2Cstripbooks%2C133&sr=1-4,,,FALSE,,lec-learning
the-scaling-era-an-oral-history-of-ai-20192025,FALSE,10/19/2025,"The Scaling Era: An Oral History of AI, 2019–2025",Dwarkesh Patel,book,https://www.amazon.com/Scaling-Era-Oral-History-2019-2025/dp/1953953557,,,FALSE,,lec-learning
andrej-karpathy-agi-is-still-a-decade-away,FALSE,10/19/2025,Andrej Karpathy — AGI is still a decade away,"Andrej Karpathy, Dwarkesh Patel",podcast,https://www.youtube.com/watch?v=lXUZvyajciY,,,FALSE,,lec-learning
leopold-aschenbrenner-2027-agi-chinaus-superintelligence-race-the-return-of-history,FALSE,10/20/2025,"Leopold Aschenbrenner — 2027 AGI, China/US super-intelligence race, & the return of history","Leopold Aschenbrenner, Dwarkesh Patel",podcast,https://www.youtube.com/watch?v=zdbVtZIn9IM,,,FALSE,,lec-learning
gwern-anonymous-writer-who-predicted-ai-trajectory-on-12kyear-salary,FALSE,10/20/2025,Gwern — Anonymous writer who predicted AI trajectory on $12K/year salary,"Gwern, Dwarkesh Patel",podcast,https://youtu.be/a42key59cZQ?si=xstXfMDvGRF1RUfI,,,FALSE,,lec-learning
statquest-principal-component-analysis-pca-stepbystep,FALSE,10/20/2025,"StatQuest: Principal Component Analysis (PCA), Step-by-Step",Josh Starmer,video,https://youtu.be/FgakZw6K1QQ?si=8C_CXN1Z88ROWVcE,,,FALSE,,lec-learning
richard-sutton-father-of-rl-thinks-llms-are-a-dead-end,FALSE,10/20/2025,Richard Sutton – Father of RL thinks LLMs are a dead end,"Richard Sutton, Dwarkesh Patel",podcast,https://www.youtube.com/watch?v=21EYKqUsPfg,,,FALSE,,lec-learning
scaling-laws-for-neural-language-models,FALSE,10/20/2025,Scaling Laws for Neural Language Models,,paper,https://arxiv.org/pdf/2001.08361,,,FALSE,,lec-learning
a-visual-guide-to-mixture-of-experts-moe-in-llms,FALSE,10/21/2025,A Visual Guide to Mixture of Experts (MoE) in LLMs,,video,https://www.youtube.com/watch?v=sOPDGQjFcuM,,,FALSE,,lec-learning
how-might-llms-store-facts-deep-learning-chapter-7,FALSE,10/21/2025,How might LLMs store facts | Deep Learning Chapter 7,3b1b,video,https://www.youtube.com/watch?v=9-Jl0dxWQs8,,,FALSE,,lec-learning
the-bitter-lesson,FALSE,10/21/2025,The Bitter Lesson,Richard Sutton,essay,https://www.cs.utexas.edu/~eunsol/courses/data/bitter_lesson.pdf,,,FALSE,,lec-learning
what-the-books-get-wrong-about-ai-double-descent,FALSE,10/22/2025,What the Books Get Wrong about AI [Double Descent],WelchLabs,video,https://www.youtube.com/watch?v=z64a7USuGX0,,,FALSE,,lec-learning
the-scaling-era-an-oral-history-of-ai-20192025,FALSE,10/15/2025,"The Scaling Era: An Oral History of AI, 2019–2025","Dwarkesh Patel, Gavin Leech",physical,https://www.amazon.com/Scaling-Era-Oral-History-2019-2025/dp/1953953557,,,FALSE,,lec-library
prompt-engineering-for-generative-ai-futureproof-inputs-for-reliable-ai-outputs,FALSE,,Prompt Engineering for Generative AI: Future-Proof Inputs for Reliable AI Outputs,"James Phoenix, Mike Taylor",physical,https://www.amazon.com/Prompt-Engineering-Generative-AI-Future-Proof/dp/109815343X/,,,FALSE,,lec-library
artificial-intelligence-for-babies-baby-university,FALSE,,Artificial Intelligence for Babies (Baby University),Chris Ferrie,physical,https://www.amazon.com/dp/1464221456?ref=ppx_yo2ov_dt_b_fed_asin_title,,,FALSE,,lec-library
abcs-of-artificial-intelligence-baby-university,FALSE,,ABCs of Artificial Intelligence (Baby University),Chris Ferrie,physical,https://www.amazon.com/dp/1464221480?ref=ppx_yo2ov_dt_b_fed_asin_title,,,FALSE,,lec-library
neural-networks-for-babies,FALSE,,Neural Networks for Babies,"Chris Ferrie, Sarah Kaiser",physical,https://www.amazon.com/dp/1492671207?ref=ppx_yo2ov_dt_b_fed_asin_title,,,FALSE,,lec-library
a-mind-at-play-how-claude-shannon-invented-the-information-age,FALSE,,A Mind at Play: How Claude Shannon Invented the Information Age,,physical,https://www.amazon.com/dp/147676669X?ref=ppx_yo2ov_dt_b_fed_asin_title,,,FALSE,,lec-library
norbert-wienera-life-in-cybernetics-exprodigy-my-childhood-and-youth-and-i-am-a-mathematician-the-later-life-of-a-prodigy-mit-press,FALSE,,Norbert Wiener-A Life in Cybernetics: Ex-Prodigy: My Childhood and Youth and I Am a Mathematician: The Later Life of a Prodigy (Mit Press),,physical,https://www.amazon.com/dp/0262535440?ref=ppx_yo2ov_dt_b_fed_asin_title,,,FALSE,,lec-library
machines-who-think-a-personal-inquiry-into-the-history-and-prospects-of-artificial-intelligence,FALSE,,Machines Who Think: A Personal Inquiry into the History and Prospects of Artificial Intelligence,Pamela McCorduck,physical,https://www.amazon.com/dp/1568812051?ref=ppx_yo2ov_dt_b_fed_asin_title,,,FALSE,,lec-library
bayesian-probability-for-babies,FALSE,,Bayesian Probability for Babies,Chris Ferrie,physical,https://www.amazon.com/dp/1492680796?ref=ppx_yo2ov_dt_b_fed_asin_title,,,FALSE,,lec-library
the-costs-of-connection-how-data-is-colonizing-human-life-and-appropriating-it-for-capitalism-culture-and-economic-life,FALSE,,The Costs of Connection: How Data Is Colonizing Human Life and Appropriating It for Capitalism (Culture and Economic Life),,physical,https://www.amazon.com/dp/150360974X?ref=ppx_yo2ov_dt_b_fed_asin_title,,,TRUE,Frazier Dougherty,lec-library
the-hundredpage-machine-learning-book,FALSE,,The Hundred-Page Machine Learning Book,Andriy Burkov,physical,https://www.amazon.com/dp/1777005477?ref=ppx_yo2ov_dt_b_fed_asin_title,,,FALSE,,lec-library
the-statquest-illustrated-guide-to-machine-learning,FALSE,,The StatQuest Illustrated Guide To Machine Learning,Josh Starmer,physical,https://www.amazon.com/dp/B0BLM4TLPY?ref=ppx_yo2ov_dt_b_fed_asin_title,,,FALSE,,lec-library
digital-signal-processing-for-complete-idiots-electrical-engineering-for-complete-idiots,FALSE,,Digital Signal Processing for Complete Idiots (Electrical Engineering for Complete Idiots),David Smith,physical,https://www.amazon.com/dp/1086340353?ref=ppx_yo2ov_dt_b_fed_asin_title,,,FALSE,,lec-library
matrices-and-linear-transformations-second-edition,FALSE,,Matrices and Linear Transformations: Second Edition,Charles G. Cullen,physical,https://www.amazon.com/dp/0486663280?ref=ppx_yo2ov_dt_b_fed_asin_title,,,FALSE,,lec-library
vector-a-surprising-story-of-space-time-and-mathematical-transformation,FALSE,,"Vector: A Surprising Story of Space, Time, and Mathematical Transformation",Robyn Arianrhod,physical,https://www.amazon.com/dp/0226821102?ref=ppx_yo2ov_dt_b_fed_asin_title,,,FALSE,,lec-library
the-master-algorithm-how-the-quest-for-the-ultimate-learning-machine-will-remake-our-world,FALSE,,The Master Algorithm: How the Quest for the Ultimate Learning Machine Will Remake Our World,Pedro Domingos,physical,https://www.amazon.com/dp/0465094279?ref=ppx_yo2ov_dt_b_fed_asin_title,,,FALSE,,lec-library
artificial-intelligence-the-very-idea,FALSE,,Artificial Intelligence: The Very Idea,John Haugeland,physical,https://www.amazon.com/dp/0262081539?ref=ppx_yo2ov_dt_b_fed_asin_title,,,FALSE,,lec-library
superintelligence-paths-dangers-strategies,FALSE,,"Superintelligence: Paths, Dangers, Strategies",Nick Bostrom,physical,https://www.amazon.com/dp/0198739834?ref=ppx_yo2ov_dt_b_fed_asin_title,,,FALSE,,lec-library
linear-algebra-done-right-undergraduate-texts-in-mathematics,FALSE,,Linear Algebra Done Right (Undergraduate Texts in Mathematics),Sheldon Axler,physical,https://www.amazon.com/dp/3031410254?ref=ppx_yo2ov_dt_b_fed_asin_title,,,FALSE,,lec-library
gdel-escher-bach-an-eternal-golden-braid,FALSE,,"Gödel, Escher, Bach: An Eternal Golden Braid",Douglas R. Hofstadter,physical,https://www.amazon.com/dp/0465026567?ref=ppx_yo2ov_dt_b_fed_asin_title,,,FALSE,,lec-library
perceptrons-reissue-of-the-1988-expanded-edition-with-a-new-foreword-by-lon-bottou-an-introduction-to-computational-geometry-mit-press,FALSE,,"Perceptrons, Reissue of the 1988 Expanded Edition with a new foreword by Léon Bottou: An Introduction to Computational Geometry (Mit Press)","Marvin L. Minsky, Simon A. Papert",physical,https://www.amazon.com/dp/0262534770?ref=ppx_yo2ov_dt_b_fed_asin_title,,,FALSE,,lec-library
constraint-processing-the-morgan-kaufmann-series-in-artificial-intelligence,FALSE,,Constraint Processing (The Morgan Kaufmann Series in Artificial Intelligence),Rina Dechter,physical,https://www.amazon.com/dp/1558608907?ref=ppx_yo2ov_dt_b_fed_asin_title,,,FALSE,,lec-library
an-introduction-to-the-approximation-of-functions-dover-books-on-mathematics,FALSE,,An Introduction to the Approximation of Functions (Dover Books on Mathematics),Theodore J. Rivlin,physical,https://www.amazon.com/dp/0486640698?ref=ppx_yo2ov_dt_b_fed_asin_title,,,FALSE,,lec-library
pattern-recognition-and-machine-learning,FALSE,,Pattern Recognition and Machine Learning,Christopher M. Bishop,physical,https://www.amazon.com/dp/0387310738?ref=ppx_yo2ov_dt_b_fed_asin_title,,,FALSE,,lec-library
why-machines-learn-the-elegant-math-behind-modern-ai,FALSE,,Why Machines Learn: The Elegant Math Behind Modern AI,Anil Ananthaswamy,physical,https://www.amazon.com/dp/0593185749?ref=ppx_yo2ov_dt_b_fed_asin_title,,,FALSE,,lec-library
infinite-powers-how-calculus-reveals-the-secrets-of-the-universe,FALSE,,Infinite Powers: How Calculus Reveals the Secrets of the Universe,Steven Strogatz,physical,https://www.amazon.com/dp/0358299284?ref=ppx_yo2ov_dt_b_fed_asin_title,,,FALSE,,lec-library
bayesian-statistics-the-fun-way-understanding-statistics-and-probability-with-star-wars-lego-and-rubber-ducks,FALSE,,"Bayesian Statistics the Fun Way: Understanding Statistics and Probability with Star Wars, LEGO, and Rubber Ducks",Will Kurt,physical,https://www.amazon.com/dp/1593279566?ref=ppx_yo2ov_dt_b_fed_asin_title,,,FALSE,,lec-library
machine-learning-with-pytorch-and-scikitlearn-develop-machine-learning-and-deep-learning-models-with-python,FALSE,,Machine Learning with PyTorch and Scikit-Learn: Develop machine learning and deep learning models with Python,"Sebastian Raschka, Yuxi Liu, Vahid Mirjalili",physical,https://www.amazon.com/dp/1801819319?ref=ppx_yo2ov_dt_b_fed_asin_title,,,FALSE,,lec-library
probability-and-statistics-for-computer-science,FALSE,,Probability and Statistics for Computer Science,David Forsyth,physical,https://www.amazon.com/dp/3319644092?ref=ppx_yo2ov_dt_b_fed_asin_title,,,FALSE,,lec-library
linear-algebra-and-optimization-for-machine-learning,FALSE,,Linear Algebra and Optimization for Machine Learning,Charu C. Aggarwal,physical,https://www.amazon.com/dp/3030403467?ref=ppx_yo2ov_dt_b_fed_asin_title,,,FALSE,,lec-library
learning-from-data,FALSE,,Learning From Data,"Yaser S. Abu-Mostafa, Malik Magdon-Ismail, Hsuan-Tien Lin",physical,https://www.amazon.com/dp/1600490069?ref=ppx_yo2ov_dt_b_fed_asin_title,,,FALSE,,lec-library
why-greatness-cannot-be-planned-the-myth-of-the-objective,FALSE,,Why Greatness Cannot Be Planned: The Myth of the Objective,,physical,https://www.amazon.com/dp/3319155237?ref=ppx_yo2ov_dt_b_fed_asin_title,,,TRUE,Frazier Dougherty,lec-library
essential-math-for-data-science-take-control-of-your-data-with-fundamental-linear-algebra-probability-and-statistics,FALSE,,"Essential Math for Data Science: Take Control of Your Data with Fundamental Linear Algebra, Probability, and Statistics",Thomas Nield,physical,https://www.amazon.com/dp/1098102932?ref=ppx_yo2ov_dt_b_fed_asin_title,,,FALSE,,lec-library
machine-learning-for-dummies,FALSE,,Machine Learning For Dummies,,physical,https://www.amazon.com/dp/1119724015?ref=ppx_yo2ov_dt_b_fed_asin_title,,,TRUE,Dannylo Correia,lec-library
foundations-of-computer-vision,FALSE,,Foundations of Computer Vision,"Antonio Torralba, Phillip Isola, William T. Freeman",physical,https://www.amazon.com/dp/0262048973?ref=ppx_yo2ov_dt_b_fed_asin_title,,,FALSE,,lec-library
the-maniac,FALSE,,The MANIAC,,physical,https://www.amazon.com/dp/0593654471?ref=ppx_yo2ov_dt_b_fed_asin_title,,,FALSE,,lec-library
recommendation-engines,FALSE,,Recommendation Engines,,physical,https://www.amazon.com/dp/0262539071?ref=ppx_yo2ov_dt_b_fed_asin_title,,,FALSE,,lec-library
introduction-to-graph-theory-dover-books-on-mathematics,FALSE,,Introduction to Graph Theory (Dover Books on Mathematics),,physical,https://www.amazon.com/dp/0486678709?ref=ppx_yo2ov_dt_b_fed_asin_title,,,FALSE,,lec-library
an-introduction-to-information-theory-symbols-signals-and-noise-dover-books-on-mathematics,FALSE,,"An Introduction to Information Theory: Symbols, Signals and Noise (Dover Books on Mathematics)",,physical,https://www.amazon.com/dp/0486240614?ref=ppx_yo2ov_dt_b_fed_asin_title,,,FALSE,,lec-library
introduction-to-algorithms-3rd-edition-the-mit-press,FALSE,,"Introduction to Algorithms, 3rd Edition (The MIT Press)","Thomas H. Cormen, Charles E. Leiserson, Ronald L. Rivest, Clifford Stein",physical,https://www.amazon.com/dp/0262033844?ref=ppx_yo2ov_dt_b_fed_asin_title,,,FALSE,,lec-library
a-programmers-introduction-to-mathematics,FALSE,,A Programmer's Introduction to Mathematics,Jeremy Kun,physical,https://www.amazon.com/dp/1727125452?ref=ppx_yo2ov_dt_b_fed_asin_title,,,FALSE,,lec-library
the-question-concerning-technology-and-other-essays,FALSE,,"The Question Concerning Technology, and Other Essays",Martin Heidegger,physical,https://www.amazon.com/dp/0062290703?ref=ppx_yo2ov_dt_b_fed_asin_title,,,FALSE,,lec-library
man-and-technics-a-contribution-to-a-philosophy-of-life,FALSE,,Man and Technics: A Contribution to a Philosophy of Life,Oswald Spengler,physical,https://www.amazon.com/dp/1910524174?ref=ppx_yo2ov_dt_b_fed_asin_title,,,FALSE,,lec-library
deep-learning-with-python,FALSE,,Deep Learning with Python,Francois Chollet,physical,https://www.amazon.com/dp/1617294438?ref=ppx_yo2ov_dt_b_fed_asin_title,,,FALSE,,lec-library
deep-learning,FALSE,,Deep Learning,"Ian Goodfellow, Yoshua Bengio, Aaron Courville",physical,https://www.amazon.com/dp/0262035618?ref=ppx_yo2ov_dt_b_fed_asin_title,,,FALSE,,lec-library
linear-algebra-demystified,FALSE,,Linear Algebra Demystified,David McMahon,physical,https://www.amazon.com/dp/0071465790?ref=ppx_yo2ov_dt_b_fed_asin_title,,,FALSE,,lec-library
all-the-mathematics-you-missed,FALSE,,All the Mathematics You Missed,Thomas A. Garrity,physical,,,,FALSE,,lec-library
partial-differential-equations-for-scientists-and-engineers,FALSE,,Partial Differential Equations for Scientists and Engineers,Stanley J. Farlow,physical,,,,FALSE,,lec-library
convex-optimization,FALSE,,Convex Optimization,"Stephen Boyd, Lieven Vandenberghe",physical,,,,FALSE,,lec-library
differential-equations-and-linear-algebra,FALSE,,Differential Equations and Linear Algebra,Gilbert Strang,physical,,,,FALSE,,lec-library
not-with-a-bug-but-with-a-sticker,FALSE,,Not with a Bug but with a Sticker,"Ram Shankar Siva Kumar, Hyrum Anderson",physical,,,,FALSE,,lec-library
artificial-neural-networks-paradigms-applications-and-hardware-implementations,FALSE,,"Artificial Neural Networks: Paradigms, Applications, and Hardware Implementations","Edgar Sanchez-Sinencio, Clifford Lau",physical,,,,FALSE,,lec-library
artificial-intelligence-a-modern-approach-fourth-edition,FALSE,,Artificial Intelligence: A Modern Approach (Fourth Edition),"Stuart Russell, Peter Norvig",physical,,,,FALSE,,lec-library
linear-algebra-and-learning-from-data,FALSE,,Linear Algebra and Learning from Data,Gilbert Strang,physical,,,,FALSE,,lec-library
an-introduction-to-statistical-learning-with-applications-in-python,FALSE,,An Introduction to Statistical Learning with Applications in Python,"Gareth James, Daniela Witten, Trevor Hastie, Robert Tibshirani, Jonathan Taylor",physical,,,,FALSE,,lec-library
probabilistic-machine-learning-an-introduction,FALSE,,Probabilistic Machine Learning: An Introduction,Kevin P. Murphy,physical,,,,FALSE,,lec-library
empire-of-ai,FALSE,,Empire of AI,Karen Hao,physical,,,,FALSE,,lec-library
nexus-a-brief-history-of-information-networks-from-the-stone-age-to-ai,FALSE,,Nexus: A Brief History of Information Networks from the Stone Age to AI,Yuval Noah Harari,physical,,,,FALSE,,lec-library
deep-learning-foundations-and-concepts,FALSE,,Deep Learning: Foundations and Concepts,"Christopher M. Bishop, Hugh Bishop",physical,,,,FALSE,,lec-library
the-quest-for-artificial-intelligence,FALSE,,The Quest for Artificial Intelligence,Nils J. Nilsson,physical,,,,FALSE,,lec-library
weapons-of-math-destruction,FALSE,,Weapons of Math Destruction,Cathy O'Neil,physical,,,,FALSE,,lec-library
you-look-like-a-thing-and-i-love-you,FALSE,,You Look Like a Thing and I Love You,Janelle Shane,physical,,,,FALSE,,lec-library
artificial-intelligence,FALSE,,Artificial Intelligence,Patrick Henry Winston,physical,,,,FALSE,,lec-library
thinking-fast-and-slow,FALSE,,Thinking Fast and Slow,Daniel Kahneman,physical,,,,FALSE,,lec-library
the-singularity-is-nearer,FALSE,,The Singularity is Nearer,Ray Kurzweil,physical,,,,FALSE,,lec-library
the-alignment-problem-machine-learning-and-human-values,FALSE,,The Alignment Problem: Machine Learning and Human Values,Brian Christian,physical,,,,FALSE,,lec-library
artificial-intelligence-foundations-of-computational-agents,FALSE,,Artificial Intelligence: Foundations of Computational Agents,"David L. Poole, Alan K. Mackworth",physical,,,,FALSE,,lec-library
deep-learning-a-visual-approach,FALSE,,Deep Learning: A Visual Approach,Andrew Glassner,physical,,,,FALSE,,lec-library
the-statquest-illustrated-guide-to-neural-networks-and-ai,FALSE,,The StatQuest Illustrated Guide to Neural Networks and AI,Josh Starmer,physical,,,,FALSE,,lec-library
reinforcement-learning-an-introduction-second-edition,FALSE,,Reinforcement Learning: An Introduction (Second Edition),"Richard S. Sutton, Andrew G. Barto",physical,,,,FALSE,,lec-library
linear-algebra-with-applications-tenth-edition,FALSE,,Linear Algebra with Applications (Tenth Edition),"Steven J. Leon, Lisette de Pillis",physical,,,,FALSE,,lec-library
deep-learning-for-dummies,FALSE,,Deep Learning for Dummies,"John Paul Mueller, Luca Massaron",physical,https://www.amazon.com/Deep-Learning-Dummies-John-Mueller/dp/1119543045,,,TRUE,Dannylo Correia,lec-library
mathematics-for-machine-learning,FALSE,,Mathematics for Machine Learning,Marc Peter Deisenroth,physical,https://www.amazon.com/Mathematics-Machine-Learning-Peter-Deisenroth/dp/110845514X/ref=sr_1_1?crid=DXHWCCE6FCGJ&dib=eyJ2IjoiMSJ9.LVLu1o48uIjPNMruxkqyg0FAet8sMSa5_C8Ci5qfCix_UAdMm2fVJY4pq6TpbZUASGQ7T8l5ccod8S78g_lMGNIjZaQRuIu5mey56LxwZdPAlWF2t5w_4aWQCb5w1rBC6HaL13KTpMsG-8qm1nN-4un1cluIm_rW1B0kgc9l3mVVKw0yRPEswV2Orn3jIdHNvvQbtgCIQIuJyJT3vHgT49bouvHMseLEmeawcQMsMGo.aorFJutLD6in9VhV7-lAkGCaogRZS11gxjbu0P33m5I&dib_tag=se&keywords=Math+for+machine+learning&qid=1761338919&s=books&sprefix=math+for+machine+learning%2Cstripbooks%2C107&sr=1-1,,,TRUE,Kristofer Ulanday,lec-library